number,values_0,values_1,params_activation,params_base_channels,params_blocks_per_stage,params_dropout,params_head_dim,params_hidden_size,params_kernel_size,params_learning_rate,params_lstm_dropout,params_n_layers,params_pooling,params_rr_dim,params_weight_decay,user_attrs_F1_F_mean,user_attrs_F1_F_std,user_attrs_F1_N_mean,user_attrs_F1_N_std,user_attrs_F1_S_mean,user_attrs_F1_S_std,user_attrs_F1_V_mean,user_attrs_F1_V_std,user_attrs_Macro_F1_mean,user_attrs_Macro_F1_std,user_attrs_Min_Rare_F1_mean,user_attrs_Min_Rare_F1_std,user_attrs_Precision_F_mean,user_attrs_Precision_F_std,user_attrs_Precision_S_mean,user_attrs_Precision_S_std,user_attrs_Rare_Macro_SF_mean,user_attrs_Rare_Macro_SF_std,user_attrs_Recall_F_mean,user_attrs_Recall_F_std,user_attrs_Recall_S_mean,user_attrs_Recall_S_std,user_attrs_best_epoch_mean,user_attrs_domain,user_attrs_model_id,user_attrs_n_parameters,user_attrs_time_s,state
0,,,relu,28,2,0.30000000000000004,64,112,5,,0.4,2,attention,32,,,,,,,,,,,,,,,,,,,,,,,,,,,553489,,PRUNED
1,0.0,0.318727926389682,relu,28,2,0.6,64,64,7,0.00010947610474239297,0.0,2,attention,32,8.031400997632364e-07,0.0,0.0,0.8912872727569843,0.040128984122633486,0.0,0.0,0.38362443280174374,0.07834737116959316,0.318727926389682,0.02961908882305667,0.0,0.0,0.0,0.0,0.0,0.0,0.0,0.0,0.0,0.0,0.0,0.0,1.0,RAW_1D,CNN_BILSTM1D,285233,33.92406892776489,COMPLETE
2,0.020704270657051414,0.35618581819702877,relu,32,1,0.5,64,96,11,0.0004116652965074176,0.0,2,attention,32,0.00010213576884051862,0.0046923879040667365,0.0066360386138466405,0.8750490065197534,0.017653408429298235,0.03671615341003609,0.0358310134065407,0.5082857249542586,0.18818160079432295,0.35618581819702877,0.06207551531100212,0.0046923879040667365,0.0066360386138466405,0.002368421052631579,0.0033494531740415412,0.18190620527069126,0.23963162366555982,0.020704270657051414,0.021233526010193668,0.25,0.3535533905932738,0.022251308900523563,0.016659583849944835,3.5,RAW_1D,CNN_BILSTM1D,477893,41.28369379043579,COMPLETE
3,0.0,0.30496454000985346,relu,32,1,0.2,128,80,5,0.00011996527080333946,0.0,2,attention,16,5.409276900065835e-07,0.0,0.0,0.883483252970846,0.04685670446123616,0.0,0.0,0.3363749070685679,0.080754203899716,0.30496454000985346,0.03190272709023806,0.0,0.0,0.0,0.0,0.0,0.0,0.0,0.0,0.0,0.0,0.0,0.0,1.0,RAW_1D,CNN_BILSTM1D,326037,30.18931794166565,COMPLETE
4,,,relu,24,1,0.5,64,96,5,,,1,attention,32,,,,,,,,,,,,,,,,,,,,,,,,,,,157885,,PRUNED
5,,,gelu,32,2,0.4,64,112,5,,0.1,2,attention,32,,,,,,,,,,,,,,,,,,,,,,,,,,,585317,,PRUNED
6,0.043130600935899904,0.3579676166243171,gelu,36,2,0.30000000000000004,64,80,7,0.0005033966732366993,0.30000000000000004,2,attention,16,3.5481828727704894e-07,0.0006430868167202572,0.0009094620979891287,0.865805399031272,0.09350390356477889,0.08561811505507956,0.0466500067392349,0.4798038655941966,0.02775659202535095,0.3579676166243171,0.018425256688226473,0.0006430868167202572,0.0009094620979891287,0.00032530904359141186,0.000460056461409595,0.1908943697060289,0.16215540410618262,0.043130600935899904,0.023779734418612013,0.027777777777777776,0.039283710065919304,0.14790575916230367,0.16844690337166446,5.5,RAW_1D,CNN_BILSTM1D,450921,49.64530420303345,COMPLETE
7,,,gelu,32,2,0.6,128,112,7,,0.2,2,mean,32,,,,,,,,,,,,,,,,,,,,,,,,,,,642756,,PRUNED
8,,,gelu,36,1,0.30000000000000004,64,80,7,,,1,attention,16,,,,,,,,,,,,,,,,,,,,,,,,,,,204889,,PRUNED
9,0.07795951470166033,0.3965431475817448,relu,32,2,0.6,64,112,5,0.0007415706069873835,,1,mean,16,1.8302369175119032e-05,0.00760043431053203,0.010748637281880202,0.9086632657828716,0.03769336457720261,0.14831859509278864,0.01247939106914109,0.521590295140787,0.19182283813500356,0.3965431475817448,0.05157204359029623,0.00760043431053203,0.010748637281880202,0.003875968992248062,0.005481447916174787,0.13876556912073004,0.04835253547514373,0.07795951470166033,0.011614014175510648,0.19444444444444445,0.27498597046143514,0.17670157068062828,0.04627662180540231,10.5,RAW_1D,CNN_BILSTM1D,281140,95.14329290390015,COMPLETE
10,,,gelu,28,1,0.30000000000000004,128,64,7,,0.1,2,attention,32,,,,,,,,,,,,,,,,,,,,,,,,,,,240577,,PRUNED
11,,,gelu,28,2,0.6,64,112,7,,0.2,2,attention,16,,,,,,,,,,,,,,,,,,,,,,,,,,,583745,,PRUNED
12,,,relu,36,1,0.4,64,96,7,,,1,mean,32,,,,,,,,,,,,,,,,,,,,,,,,,,,239880,,PRUNED
13,,,gelu,32,1,0.4,128,96,7,,,1,mean,16,,,,,,,,,,,,,,,,,,,,,,,,,,,226548,,PRUNED
14,0.08087946603847664,0.3265095739004482,relu,24,1,0.5,128,112,11,0.00028347012282275275,0.4,2,attention,32,1.3175350473797698e-06,0.0,0.0,0.8449334836065516,0.030382411445471276,0.16175893207695327,0.08550800494913884,0.299345879918288,0.023880047106454652,0.3265095739004482,0.007811386599303247,0.0,0.0,0.0,0.0,0.2531814010400734,0.2278359047487888,0.08087946603847664,0.04275400247456942,0.0,0.0,0.13219895287958114,0.027765973083241396,5.5,RAW_1D,CNN_BILSTM1D,547101,44.18520188331604,COMPLETE
15,,,gelu,24,1,0.30000000000000004,64,112,5,,,1,attention,16,,,,,,,,,,,,,,,,,,,,,,,,,,,191885,,PRUNED
16,0.17771809294869317,0.425717697726625,relu,32,1,0.2,64,64,7,0.0020361252908009035,0.4,2,mean,16,0.00028086221131178084,0.025423728813559324,0.03595458209423123,0.9391457761529753,0.041899552989793656,0.33001245708382704,0.002419111705453926,0.4082888288561384,0.07347662452723326,0.425717697726625,0.03722791197645108,0.025423728813559324,0.03595458209423123,0.013761467889908258,0.019461654528070117,0.509400090467036,0.11092772613378242,0.17771809294869317,0.016767735194388664,0.16666666666666666,0.23570226039551584,0.24869109947643978,0.02961703795545748,5.0,RAW_1D,CNN_BILSTM1D,250292,44.32653498649597,COMPLETE
17,0.01762977473065622,0.2977434028584301,relu,32,1,0.5,128,112,7,0.00011186053320623365,,1,attention,32,0.0002651635229780773,0.0,0.0,0.8336838883414434,0.10336988881255241,0.03525954946131244,0.04986453305135301,0.32203017363096453,0.03631772531307018,0.2977434028584301,0.022455770268567366,0.0,0.0,0.0,0.0,0.021686746987951807,0.030669691714115314,0.01762977473065622,0.024932266525676504,0.0,0.0,0.09424083769633508,0.1332766707995587,4.0,RAW_1D,CNN_BILSTM1D,268069,41.79079008102417,COMPLETE
18,0.03132483954401763,0.3344208253223957,relu,24,2,0.6,64,64,7,0.00011882329917569164,0.30000000000000004,2,mean,16,7.579622323812076e-05,0.0136986301369863,0.019372788525658834,0.8917710040088148,0.07374448632804234,0.04895104895104895,0.0692272373189627,0.38326261819273266,0.054925126411860564,0.3344208253223957,0.01001739672382032,0.0136986301369863,0.019372788525658834,0.0078125,0.011048543456039806,0.03674540682414698,0.05196585268562554,0.03132483954401763,0.04430001292231077,0.05555555555555555,0.07856742013183861,0.07329842931937172,0.1036596328441012,3.0,RAW_1D,CNN_BILSTM1D,250188,39.34856343269348,COMPLETE
19,,,gelu,24,2,0.4,64,96,5,,,1,mean,16,,,,,,,,,,,,,,,,,,,,,,,,,,,185676,,PRUNED
20,0.0,0.2622887471802362,gelu,32,1,0.2,128,64,11,0.00016611741929252363,0.1,2,attention,32,2.8688202270683723e-05,0.0,0.0,0.8041420500759142,0.011004614647143434,0.0,0.0,0.24501293864503082,0.020563512313067224,0.2622887471802362,0.00789203174005264,0.0,0.0,0.0,0.0,0.0,0.0,0.0,0.0,0.0,0.0,0.0,0.0,1.0,RAW_1D,CNN_BILSTM1D,303045,30.746896505355835,COMPLETE
21,0.09136071710483247,0.40435256830493815,gelu,36,2,0.4,128,112,5,0.0010256441281792197,,1,mean,16,1.8500362518469734e-05,0.0017690532572839915,0.0013359381837243505,0.8334731972176748,0.15750227609991388,0.18095238095238095,0.12121830534626529,0.6012156417924128,0.1481554750576702,0.40435256830493815,0.10705299867189348,0.0017690532572839915,0.0013359381837243505,0.0009030514880856116,0.0006898096709531502,0.25632424287690536,0.2819545293006351,0.09136071710483247,0.061277121764994814,0.05555555555555555,0.0,0.2395287958115183,0.07219153001642763,14.5,RAW_1D,CNN_BILSTM1D,331912,78.23086333274841,COMPLETE
22,,,relu,24,2,0.4,64,80,7,,,1,mean,32,,,,,,,,,,,,,,,,,,,,,,,,,,,178844,,PRUNED
23,0.001148105625717566,0.3748174502142717,relu,32,1,0.30000000000000004,64,64,7,0.00025468209499096653,0.1,2,mean,16,0.0005586542263948895,0.002296211251435132,0.003247333093853261,0.9281843540864251,0.055600142245865736,0.0,0.0,0.5687892355192268,0.01600602830087229,0.3748174502142717,0.00908669521278508,0.0,0.0,0.001160092807424594,0.0016406189818713398,0.0,0.0,0.001148105625717566,0.0016236665469266305,0.1111111111111111,0.15713484026367722,0.0,0.0,2.0,RAW_1D,CNN_BILSTM1D,250292,33.1199791431427,COMPLETE
24,0.006605138590332013,0.2748207751136975,relu,32,2,0.5,64,64,11,0.00013572915538349707,0.0,2,mean,32,1.5669413899053796e-06,0.0014731879787860931,0.0020834024195243005,0.7715538793766913,0.08569514435973159,0.011737089201877934,0.01659875073207858,0.3145189438974349,0.05123639851653064,0.2748207751136975,0.003944148172899535,0.0014731879787860931,0.0020834024195243005,0.000740521327014218,0.0010472553038900288,0.056818181818181816,0.08035304331665312,0.006605138590332013,0.00934107657580144,0.1388888888888889,0.19641855032959654,0.006544502617801047,0.009255324361080465,3.5,RAW_1D,CNN_BILSTM1D,405380,57.80422329902649,COMPLETE
25,0.020234986945169713,0.30304309255693296,relu,24,2,0.6,64,96,11,0.00012683874930392354,,1,mean,16,0.0003466070380518357,0.0,0.0,0.8431201817348295,0.011074839862400735,0.04046997389033943,0.05723318594460307,0.32858221460256304,0.021751620103022867,0.30304309255693296,0.016977491546306293,0.0,0.0,0.0,0.0,0.026956521739130435,0.03812227863788343,0.020234986945169713,0.028616592972301534,0.0,0.0,0.08115183246073299,0.11476602207739776,5.5,RAW_1D,CNN_BILSTM1D,254796,46.14312553405762,COMPLETE
26,0.05481036077705828,0.28622132368537123,relu,24,1,0.6,128,80,11,0.00017574845777197176,0.2,2,attention,16,6.891102523759595e-07,0.0,0.0,0.796392319342691,0.022038230359532465,0.10962072155411656,0.038883968335368786,0.23887225384467756,0.010564926338788463,0.28622132368537123,0.0068526660786561765,0.0,0.0,0.0,0.0,0.6192835365853658,0.12449822138269241,0.05481036077705828,0.019441984167684393,0.0,0.0,0.06020942408376963,0.022212778466593117,5.5,RAW_1D,CNN_BILSTM1D,326797,43.013352394104004,COMPLETE
27,0.009664257261511267,0.3661972543846538,relu,24,1,0.6,64,112,5,0.0010247701934852386,0.30000000000000004,2,mean,32,6.115817026262544e-05,0.011921107115615125,0.008660651869387375,0.942847232816702,0.007755604253797506,0.007407407407407408,0.010475656017578482,0.5026132701988906,0.050008590337764315,0.3661972543846538,0.0148947996849382,0.002898550724637681,0.004099169746008971,0.006165837150055064,0.00439499840364283,0.06521739130434782,0.09223131928520185,0.009664257261511267,0.0009075020740955532,0.19444444444444442,0.19641855032959654,0.003926701570680628,0.005553194616648279,3.0,RAW_1D,CNN_BILSTM1D,495612,34.09610557556152,COMPLETE
28,,,relu,24,1,0.6,64,64,7,,,1,mean,32,,,,,,,,,,,,,,,,,,,,,,,,,,,111356,,PRUNED
29,,,gelu,24,1,0.6,64,64,5,,,1,attention,16,,,,,,,,,,,,,,,,,,,,,,,,,,,98861,,PRUNED
30,,,gelu,28,2,0.2,128,80,5,,,1,attention,32,,,,,,,,,,,,,,,,,,,,,,,,,,,195089,,PRUNED
31,,,relu,28,1,0.30000000000000004,64,96,5,,,1,attention,16,,,,,,,,,,,,,,,,,,,,,,,,,,,173873,,PRUNED
32,0.0850400928590887,0.37365723873271406,gelu,32,1,0.6,64,112,7,0.0012941931521301547,,1,mean,16,4.023235409060838e-07,0.005649717514124294,0.007989907132051385,0.814047123965271,0.0420685901624873,0.1644304682040531,0.0084002902027752,0.5105016452474079,0.08582126072773213,0.37365723873271406,0.01104076340899218,0.005649717514124294,0.007989907132051385,0.0028538812785388126,0.004035997609512258,0.28746151214505644,0.005201093327235987,0.0850400928590887,0.00020519153536190544,0.2777777777777778,0.3928371006591931,0.11518324607329844,0.007404259488864371,12.0,RAW_1D,CNN_BILSTM1D,250036,69.61305236816406,COMPLETE
33,,,gelu,24,2,0.6,128,64,5,,0.1,2,attention,32,,,,,,,,,,,,,,,,,,,,,,,,,,,238941,,PRUNED
34,0.12319954089717969,0.4718711254409392,gelu,32,1,0.30000000000000004,128,80,7,0.0015125507287414173,0.2,2,attention,16,1.0007814372411644e-06,0.0073972644027114854,0.008430854266789951,0.9246790866178016,0.006934186533974975,0.23900181739164789,0.0874629431946499,0.7164063333515955,0.16814427901271295,0.4718711254409392,0.016329073754324554,0.0073972644027114854,0.008430854266789951,0.003761694616063548,0.004291320589089763,0.7986997635933806,0.01387467206583531,0.12319954089717969,0.047946898730719924,0.2222222222222222,0.23570226039551584,0.14267015706806283,0.06108514078313108,8.5,RAW_1D,CNN_BILSTM1D,346517,58.71718978881836,COMPLETE
35,,,gelu,32,2,0.30000000000000004,128,112,5,,0.0,2,mean,32,,,,,,,,,,,,,,,,,,,,,,,,,,,601796,,PRUNED
36,,,gelu,28,2,0.5,64,80,7,,,1,attention,32,,,,,,,,,,,,,,,,,,,,,,,,,,,213841,,PRUNED
37,0.12228959087974856,0.373435136039196,relu,24,2,0.30000000000000004,64,96,7,0.0005176581414783493,0.4,2,mean,32,0.0002355829813682306,0.01694915254237288,0.023969721396154154,0.8998566252430412,0.013739127136556123,0.22763002921712422,0.027198007402497983,0.34930473715424576,0.018921310879744687,0.373435136039196,0.020957041703738216,0.01694915254237288,0.023969721396154154,0.012195121951219513,0.017246506858208478,0.43564415708812265,0.2530582098858466,0.12228959087974856,0.025583864399326067,0.027777777777777776,0.039283710065919304,0.16492146596858637,0.014808518977728741,8.5,RAW_1D,CNN_BILSTM1D,432540,59.802040100097656,COMPLETE
38,0.1717472700419686,0.47851625076884874,relu,32,1,0.2,64,112,5,0.001560538027412472,0.2,2,mean,32,6.7443437103342675e-06,0.00955641135358722,0.0002823989427075071,0.9094519593415483,0.04806562743929477,0.33393812873035,0.03440723304089553,0.6611185036499094,0.026515773356476976,0.47851625076884874,0.003284944475196333,0.00955641135358722,0.0002823989427075071,0.004846488717456459,9.548232083867218e-05,0.6027777777777777,0.16891995328345302,0.1717472700419686,0.017344815991801522,0.4444444444444444,0.31426968052735443,0.23298429319371727,0.00740425948886438,8.0,RAW_1D,CNN_BILSTM1D,533508,59.662816286087036,COMPLETE
