number,values_0,values_1,params_activation,params_base_channels,params_blocks_per_stage,params_dropout,params_head_dim,params_kernel_size,params_learning_rate,params_pool_bins,params_rr_dim,params_weight_decay,user_attrs_F1_F_mean,user_attrs_F1_F_std,user_attrs_F1_N_mean,user_attrs_F1_N_std,user_attrs_F1_S_mean,user_attrs_F1_S_std,user_attrs_F1_V_mean,user_attrs_F1_V_std,user_attrs_Macro_F1_mean,user_attrs_Macro_F1_std,user_attrs_Min_Rare_F1_mean,user_attrs_Min_Rare_F1_std,user_attrs_Precision_F_mean,user_attrs_Precision_F_std,user_attrs_Precision_S_mean,user_attrs_Precision_S_std,user_attrs_Rare_Macro_SF_mean,user_attrs_Rare_Macro_SF_std,user_attrs_Recall_F_mean,user_attrs_Recall_F_std,user_attrs_Recall_S_mean,user_attrs_Recall_S_std,user_attrs_best_epoch_mean,user_attrs_domain,user_attrs_model_id,user_attrs_n_parameters,user_attrs_time_s,state
114,,,gelu,26,1,0.6,64,5,,2,16,,,,,,,,,,,,,,,,,,,,,,,,,,,746978,,PRUNED
115,,,gelu,22,1,0.5,64,3,,2,16,,,,,,,,,,,,,,,,,,,,,,,,,,,213750,,PRUNED
116,,,relu,26,1,0.4,128,5,,3,32,,,,,,,,,,,,,,,,,,,,,,,,,,,843634,,PRUNED
117,,,gelu,22,2,0.2,128,5,,4,16,,,,,,,,,,,,,,,,,,,,,,,,,,,1206854,,PRUNED
118,,,gelu,34,2,0.4,64,3,,2,32,,,,,,,,,,,,,,,,,,,,,,,,,,,926890,,PRUNED
119,,,gelu,22,1,0.6,128,5,,2,32,,,,,,,,,,,,,,,,,,,,,,,,,,,564998,,PRUNED
120,0.08359304801879483,0.35227471426865253,gelu,22,2,0.6,128,3,0.0013596233431489517,3,16,2.4885463512002495e-05,0.06304914881933003,0.08761173394026073,0.8837514460523108,0.002240514038403769,0.10413694721825963,0.14727188310019393,0.3581613149847095,0.1475571834287983,0.35227471426865253,0.02239173691251508,0.0625,0.08838834764831845,0.05027731558513589,0.07031849465709816,0.11442006269592477,0.16181440447215664,0.08359304801879483,0.11744180852022731,0.1111111111111111,0.07856742013183861,0.09554973821989529,0.1351277356717748,10.5,STFT_2D,CNN2D,477510,184.00700187683105,COMPLETE
121,,,gelu,26,2,0.6,128,5,,3,16,,,,,,,,,,,,,,,,,,,,,,,,,,,1552034,,PRUNED
122,,,relu,22,1,0.5,64,5,,3,16,,,,,,,,,,,,,,,,,,,,,,,,,,,567158,,PRUNED
123,,,gelu,30,2,0.4,64,5,,4,32,,,,,,,,,,,,,,,,,,,,,,,,,,,2027982,,PRUNED
124,,,gelu,34,2,0.2,64,5,,2,16,,,,,,,,,,,,,,,,,,,,,,,,,,,2479450,,PRUNED
125,,,gelu,26,2,0.4,64,5,,3,16,,,,,,,,,,,,,,,,,,,,,,,,,,,1490786,,PRUNED
126,,,relu,22,1,0.2,128,5,,4,32,,,,,,,,,,,,,,,,,,,,,,,,,,,700166,,PRUNED
127,,,relu,26,2,0.6,128,3,,4,32,,,,,,,,,,,,,,,,,,,,,,,,,,,738802,,PRUNED
128,,,gelu,30,2,0.5,64,5,,4,32,,,,,,,,,,,,,,,,,,,,,,,,,,,2027982,,PRUNED
129,,,relu,26,2,0.30000000000000004,64,3,,2,32,,,,,,,,,,,,,,,,,,,,,,,,,,,550066,,PRUNED
130,,,gelu,26,2,0.5,128,3,,3,16,,,,,,,,,,,,,,,,,,,,,,,,,,,643490,,PRUNED
131,,,relu,26,2,0.4,128,3,,4,32,,,,,,,,,,,,,,,,,,,,,,,,,,,738802,,PRUNED
132,0.03204251607155968,0.30060412540425496,gelu,22,2,0.30000000000000004,128,3,0.0007816712660458615,3,16,1.7139401678227557e-07,0.01054647877119258,0.0056803698278552715,0.8125620010314158,0.026999001527044632,0.053538553371926784,0.0064756061893647115,0.32576946844248456,0.06398239030173727,0.30060412540425496,0.019706353952890446,0.01054647877119258,0.0056803698278552715,0.005368368468844905,0.0029356248884548266,0.04213921349067348,0.005427465986310367,0.03204251607155968,0.006077988008609992,0.3611111111111111,0.039283710065919325,0.08638743455497383,0.048127686677618416,4.5,STFT_2D,CNN2D,477510,121.28322386741638,COMPLETE
