number,values_0,values_1,params_activation,params_base_channels,params_blocks_per_stage,params_dropout,params_head_dim,params_hidden_size,params_kernel_size,params_learning_rate,params_lstm_dropout,params_n_layers,params_pooling,params_rr_dim,params_weight_decay,user_attrs_F1_F_mean,user_attrs_F1_F_std,user_attrs_F1_N_mean,user_attrs_F1_N_std,user_attrs_F1_S_mean,user_attrs_F1_S_std,user_attrs_F1_V_mean,user_attrs_F1_V_std,user_attrs_Macro_F1_mean,user_attrs_Macro_F1_std,user_attrs_Min_Rare_F1_mean,user_attrs_Min_Rare_F1_std,user_attrs_Precision_F_mean,user_attrs_Precision_F_std,user_attrs_Precision_S_mean,user_attrs_Precision_S_std,user_attrs_Rare_Macro_SF_mean,user_attrs_Rare_Macro_SF_std,user_attrs_Recall_F_mean,user_attrs_Recall_F_std,user_attrs_Recall_S_mean,user_attrs_Recall_S_std,user_attrs_best_epoch_mean,user_attrs_domain,user_attrs_model_id,user_attrs_n_parameters,user_attrs_time_s,state
0,0.18326336671015275,0.4669908363154294,gelu,16,2,0.30000000000000004,64,80,3,0.002188988126543485,0.1,2,mean,32,7.00541163471428e-06,0.008453690448145262,0.008393072897036925,0.8646931194166487,0.10916139110338127,0.35807304297216025,0.02104035358705731,0.6367434924247635,0.05426579969169499,0.4669908363154294,0.0210822544739451,0.008453690448145262,0.008393072897036925,0.004297512559085995,0.004288362738881999,0.7772452830188679,0.11489818112412359,0.18326336671015275,0.014716713242047118,0.33333333333333337,0.07856742013183861,0.23298429319371727,0.00740425948886438,10.0,STFT_2D,CNN_BILSTM2D,288468,84.78129720687866,COMPLETE
1,,,relu,24,1,0.4,128,64,3,,,1,attention,32,,,,,,,,,,,,,,,,,,,,,,,,,,,134381,,PRUNED
2,0.07317321240758483,0.3200747751009934,gelu,20,1,0.5,128,96,3,0.00012871453810729287,0.30000000000000004,2,mean,32,0.00010632597548623684,0.10797957353915721,0.12459059957756187,0.8616005074188997,0.004490393859673271,0.03836685127601244,0.010855947638816818,0.2723521681699044,0.013023591766523677,0.3200747751009934,0.03824013321064392,0.03296194058669565,0.01849964563906393,0.08091221493283349,0.09984763045808169,0.3588924387646432,0.43525848724794935,0.07317321240758483,0.06772327360818935,0.2777777777777778,0.0,0.02879581151832461,0.018510648722160933,9.5,STFT_2D,CNN_BILSTM2D,396320,78.00226545333862,COMPLETE
3,,,relu,24,1,0.5,128,64,5,,,1,attention,16,,,,,,,,,,,,,,,,,,,,,,,,,,,224413,,PRUNED
4,0.05277478009107349,0.3152109717402498,gelu,24,1,0.5,128,96,5,0.00013517515928503557,,1,mean,16,0.00013060239681830966,0.052696871628910465,0.06689672568507035,0.8391528872069585,0.07011557222315046,0.05285268855323651,0.010753425051583462,0.3161414395718937,0.10645793019369874,0.3152109717402498,0.004950235665734689,0.025321306018050736,0.028181829520558022,0.25136165577342046,0.3516277185312189,0.10310734463276836,0.08988645523557807,0.05277478009107349,0.028071650316743448,0.16666666666666669,0.15713484026367724,0.07722513089005235,0.07219153001642763,5.5,STFT_2D,CNN_BILSTM2D,286236,66.74845862388611,COMPLETE
5,,,gelu,20,1,0.4,128,64,5,,,1,attention,32,,,,,,,,,,,,,,,,,,,,,,,,,,,177825,,PRUNED
6,0.0988747754546542,0.40131503092861126,gelu,16,1,0.30000000000000004,64,112,3,0.00039116556310351484,0.30000000000000004,2,mean,32,0.00020786085233876254,0.08450704225352113,0.11951100527096577,0.9314812832093071,0.04382934819191026,0.11324250865578725,0.035118889837365004,0.47602928959582946,0.01942957862669523,0.40131503092861126,0.014998086467096402,0.044204851752021566,0.06251510087040098,0.05660377358490566,0.08004982428526954,0.19970935166327222,0.203704238410814,0.0988747754546542,0.04219605771680039,0.16666666666666666,0.23570226039551584,0.1505235602094241,0.09070217873858857,7.0,STFT_2D,CNN_BILSTM2D,475156,65.52056312561035,COMPLETE
7,0.17040237380730414,0.4688336237887405,gelu,16,1,0.30000000000000004,64,112,3,0.0018924243883539315,0.2,2,attention,16,4.688217015236656e-07,0.004800589610450245,0.002464246817137195,0.9248698306437981,0.03322336802091108,0.336004158004158,0.028278390941589224,0.6096599168965557,0.059143430708555336,0.4688336237887405,2.6479640798096783e-05,0.004800589610450245,0.002464246817137195,0.0024381459008672043,0.001224452769904392,0.7609570279061804,0.0095031471191823,0.17040237380730414,0.012907072062226011,0.19444444444444442,0.19641855032959654,0.21596858638743455,0.024063843338809215,4.0,STFT_2D,CNN_BILSTM2D,474277,52.761112689971924,COMPLETE
8,,,relu,12,1,0.2,128,112,3,,,1,mean,32,,,,,,,,,,,,,,,,,,,,,,,,,,,171272,,PRUNED
9,,,gelu,16,2,0.4,128,112,5,,0.1,2,attention,16,,,,,,,,,,,,,,,,,,,,,,,,,,,595109,,PRUNED
10,0.047732971468457494,0.3145941246606525,relu,16,2,0.30000000000000004,64,96,5,0.0001794691406203298,0.30000000000000004,2,mean,16,1.7577266220859303e-05,0.024096385542168676,0.034077435237905906,0.8543226846626224,0.012498972607911805,0.0713695573947463,0.015437777124199427,0.3085878710430727,0.024859313514890596,0.3145941246606525,0.0015698293016819282,0.024096385542168676,0.034077435237905906,0.015384615384615385,0.02175713172881685,0.05544200306591722,0.0039745399044721665,0.047732971468457494,0.009319829056853237,0.05555555555555555,0.07856742013183861,0.1256544502617801,0.08885111386637247,10.0,STFT_2D,CNN_BILSTM2D,466052,103.35140895843506,COMPLETE
11,,,relu,24,1,0.5,128,80,3,,,1,mean,16,,,,,,,,,,,,,,,,,,,,,,,,,,,161052,,PRUNED
12,0.1721263019414204,0.44687239972700465,gelu,24,2,0.30000000000000004,64,64,3,0.0024782793542530777,0.2,2,mean,16,6.110898680817754e-06,0.006535947712418301,0.009243225897863368,0.9490746857350127,0.009582770004476758,0.33771665617042246,0.03416362956665104,0.49416230929016547,0.0839755779104144,0.44687239972700465,0.012368101059287488,0.006535947712418301,0.009243225897863368,0.003367003367003367,0.004761661826172037,0.6473980309423347,0.24723874233892504,0.1721263019414204,0.012460201834393834,0.1111111111111111,0.15713484026367722,0.24345549738219896,0.07034046514421151,9.0,STFT_2D,CNN_BILSTM2D,274044,98.05272150039673,COMPLETE
13,0.10357598978288633,0.3977282266483374,gelu,16,1,0.5,128,112,3,0.0005231305367085405,0.1,2,mean,32,8.601052474064113e-05,0.10344827586206896,0.14629795472825122,0.923715505881146,0.06755840741676694,0.1037037037037037,0.14665918424609875,0.4600454211464307,0.22393154352249622,0.3977282266483374,0.00036679700877168485,0.10344827586206896,0.14629795472825122,0.13636363636363635,0.1928473039599675,0.17721518987341772,0.2506201249775105,0.10357598978288633,0.14647856948717497,0.08333333333333333,0.11785113019775792,0.07329842931937172,0.1036596328441012,8.0,STFT_2D,CNN_BILSTM2D,491860,69.87251853942871,COMPLETE
14,0.22439781200692901,0.4077206093987735,gelu,16,2,0.2,64,64,5,0.0008213723823045083,0.30000000000000004,2,mean,32,1.4940938661398852e-05,0.08494208494208494,0.08190426036909816,0.9008674130456087,0.01182054535076703,0.3638535390717731,0.11119160376667227,0.2812194005356274,0.02270396313045007,0.4077206093987735,0.010042690294314286,0.08494208494208494,0.08190426036909816,0.1076923076923077,0.1305427903729011,0.5444286053694465,0.1960545530160848,0.22439781200692901,0.014643671698787053,0.1111111111111111,0.0,0.27356020942408377,0.0758936597608598,5.0,STFT_2D,CNN_BILSTM2D,290004,71.66755986213684,COMPLETE
15,,,relu,16,2,0.6,128,80,5,,,1,attention,16,,,,,,,,,,,,,,,,,,,,,,,,,,,226149,,PRUNED
16,0.031337177589028285,0.3320037720933895,relu,20,2,0.30000000000000004,128,80,3,0.00013212216131574034,0.2,2,mean,16,3.326320368800261e-07,0.012195121951219513,0.017246506858208478,0.9067499649893487,0.021590533941725776,0.05047923322683706,0.07138841624758754,0.3585907682061528,0.03908658209640387,0.3320037720933895,0.026532742815118512,0.012195121951219513,0.017246506858208478,0.006578947368421052,0.009304036594559835,0.033389687235841084,0.04722014853232228,0.031337177589028285,0.04431746155289801,0.08333333333333333,0.11785113019775792,0.10340314136125654,0.14623412490507134,5.0,STFT_2D,CNN_BILSTM2D,330592,66.34088563919067,COMPLETE
17,0.03951950340280335,0.30626341570493654,relu,16,2,0.2,128,80,3,0.00016478949603755943,0.0,2,attention,32,8.287147543102527e-07,0.0053475935828877,0.0075626393709791176,0.8415767351602431,0.08388588527319019,0.07369141322271901,0.0276180716688386,0.30443792085389615,0.12721382330533743,0.30626341570493654,0.043979749384677455,0.0053475935828877,0.0075626393709791176,0.0029585798816568047,0.00418406379400324,0.14417344173441735,0.1418046119452697,0.03951950340280335,0.01759035551990886,0.027777777777777776,0.039283710065919304,0.06413612565445026,0.00925532436108047,6.0,STFT_2D,CNN_BILSTM2D,301237,66.86140704154968,COMPLETE
18,,,relu,16,1,0.2,64,80,3,,,1,attention,16,,,,,,,,,,,,,,,,,,,,,,,,,,,109413,,PRUNED
19,0.18839109939677645,0.47627173026008635,relu,16,1,0.30000000000000004,128,80,3,0.0028628972056417537,0.1,2,mean,32,9.72601754873976e-05,0.017874778678387444,0.014558247325595642,0.93552521131351,0.04572746427816345,0.3589074201151654,0.11018941785175694,0.5927795109332826,0.02721278808545067,0.47627173026008635,0.005672729540636774,0.017874778678387444,0.014558247325595642,0.009335330533461002,0.007780246018193865,0.685077519379845,0.026036877601830283,0.18839109939677645,0.04781558526308065,0.3055555555555556,0.03928371006591928,0.24738219895287955,0.09810643822745291,4.0,STFT_2D,CNN_BILSTM2D,277844,51.34785342216492,COMPLETE
20,,,gelu,20,2,0.6,128,64,3,,0.1,2,attention,16,,,,,,,,,,,,,,,,,,,,,,,,,,,247265,,PRUNED
21,0.02096297818731279,0.29730577772598527,relu,20,1,0.4,128,80,3,0.00010969599412562158,0.2,2,attention,16,1.3738334440381752e-06,0.002002002002002002,0.002831258383129319,0.8220656483441289,0.0035271561119010683,0.039923954372623575,0.05646099773732889,0.32523150618518665,0.08853145677593195,0.29730577772598527,0.036074139196122255,0.002002002002002002,0.002831258383129319,0.00101010101010101,0.0014284985478516111,0.07291666666666667,0.10311973892303819,0.02096297818731279,0.029646128060229107,0.1111111111111111,0.15713484026367722,0.0274869109947644,0.038872362316537956,9.0,STFT_2D,CNN_BILSTM2D,294513,75.79004406929016,COMPLETE
22,0.015222177685892298,0.32830836877061415,relu,12,1,0.6,128,112,5,0.00020941002693072985,0.2,2,mean,16,0.00024339736012619963,0.002737226277372263,0.0038710225247438734,0.8692178840337775,0.026822211710107104,0.027707129094412333,0.017384744755183715,0.41357123567689436,0.11880171882129803,0.32830836877061415,0.028308818597779624,0.002737226277372263,0.0038710225247438734,0.0013914656771799629,0.0019678296322445665,0.02682205586193418,0.0033587917599252216,0.015222177685892298,0.010627883639963793,0.08333333333333333,0.11785113019775792,0.060209424083769635,0.07034046514421154,9.5,STFT_2D,CNN_BILSTM2D,495032,77.4615957736969,COMPLETE
23,0.1632256554307116,0.448623278211007,relu,24,2,0.2,128,64,5,0.0017523281374799055,0.1,2,attention,16,0.0005515294505920094,0.0056179775280898875,0.007945020013331994,0.9623678670785176,0.021119850195109906,0.3208333333333333,0.07660323462854265,0.5056739349040873,0.18760683028044203,0.448623278211007,0.07331873377935659,0.0056179775280898875,0.007945020013331994,0.003125,0.004419417382415923,0.3708249970577851,0.09002566975257231,0.1632256554307116,0.042274127320937334,0.027777777777777776,0.039283710065919304,0.28272251308900526,0.06663833539977936,9.0,STFT_2D,CNN_BILSTM2D,468029,119.34957265853882,COMPLETE
24,0.03942926676087298,0.38470899820628235,relu,16,2,0.2,128,112,3,0.0001439256446917474,0.30000000000000004,2,attention,32,8.835522886995981e-07,0.022727272727272728,0.03214121732666125,0.9469909050852514,0.01286173668887313,0.05613126079447323,0.07938159028864523,0.5129865542181321,0.12506473831606832,0.38470899820628235,0.05593145231062541,0.022727272727272728,0.03214121732666125,0.019230769230769232,0.02719641466102106,0.04188144329896907,0.059229305125161835,0.03942926676087298,0.055761403807653244,0.027777777777777776,0.039283710065919304,0.08507853403141362,0.12031921669404605,5.5,STFT_2D,CNN_BILSTM2D,515317,65.13674235343933,COMPLETE
25,,,gelu,12,1,0.2,64,96,5,,,1,mean,16,,,,,,,,,,,,,,,,,,,,,,,,,,,144504,,PRUNED
26,,,gelu,12,2,0.2,64,80,5,,,1,mean,16,,,,,,,,,,,,,,,,,,,,,,,,,,,152744,,PRUNED
27,0.03214288673975917,0.3387194963775031,relu,12,1,0.5,128,80,5,0.00017574845777197176,0.2,2,attention,32,6.891102523759595e-07,0.0013698630136986301,0.0019372788525658837,0.8830686793998691,0.10930918798431147,0.06291591046581972,0.0889765338698136,0.4075235326306248,0.09972910629699777,0.3387194963775031,0.020333432758766482,0.0013698630136986301,0.0019372788525658837,0.0006906077348066298,0.0009766668248432976,0.040912667191188044,0.05785924881463489,0.03214288673975917,0.045456906361189736,0.08333333333333333,0.11785113019775792,0.13612565445026178,0.19251074671047366,4.5,STFT_2D,CNN_BILSTM2D,285353,55.58888053894043,COMPLETE
28,0.084662389568045,0.39942403556543804,relu,12,1,0.6,64,96,3,0.000820591520801455,0.4,2,attention,32,5.454389808533275e-05,0.02259138047695983,0.024059421252518788,0.8954182563246291,0.03860801480578653,0.14673339865913018,0.0528952340341265,0.532953106801033,0.12885800918817286,0.39942403556543804,0.029771451790998476,0.02259138047695983,0.024059421252518788,0.013454662531984478,0.01504966900802033,0.14301850942744415,0.08145696810674137,0.084662389568045,0.014417906390803854,0.2222222222222222,0.15713484026367722,0.16099476439790578,0.012957454105512665,7.0,STFT_2D,CNN_BILSTM2D,345481,67.53455686569214,COMPLETE
29,0.2227334681998699,0.4561267729505261,relu,16,1,0.2,128,96,5,0.0013097745792045425,0.4,2,attention,16,0.0007689006027135491,0.010309278350515464,0.014579521261578299,0.9623028784516732,0.007551579837806438,0.43515765804922435,0.07503510301121873,0.41673727695069157,0.2575655675474233,0.4561267729505261,0.0849071529956034,0.010309278350515464,0.014579521261578299,0.0053533190578158455,0.007570736415273527,0.6208756044372807,0.0892180097718781,0.2227334681998699,0.044807312136398526,0.1388888888888889,0.19641855032959654,0.33507853403141363,0.06293620565534715,8.0,STFT_2D,CNN_BILSTM2D,415685,72.01010847091675,COMPLETE
30,,,gelu,16,2,0.4,128,64,3,,0.1,2,attention,16,,,,,,,,,,,,,,,,,,,,,,,,,,,216645,,PRUNED
31,0.04838709677419355,0.30758405818983836,gelu,12,2,0.4,64,80,3,0.0003147069027788184,0.2,2,attention,16,1.1017274968687712e-06,0.0967741935483871,0.1368593770038479,0.8761255870746762,0.005974186972570292,0.0,0.0,0.25743645213628985,0.03441839389226029,0.30758405818983836,0.04431298946716964,0.0,0.0,0.11538461538461539,0.16317848796612636,0.0,0.0,0.04838709677419355,0.06842968850192395,0.08333333333333333,0.11785113019775792,0.0,0.0,2.5,STFT_2D,CNN_BILSTM2D,261705,48.73085927963257,COMPLETE
